{
  "id": "event-engagement-window-end", "type": "engagement.window_ending", "source_kind": "engagement_window", "source_id": "eng-42:authorized_to:86400", "schema_version": 1,
  "occurred_at": "2026-10-26T08:00:00Z", "engagement_id": "eng-42",
  "data": {"title": "Engagement window ending", "summary": "The authorization window ends in 24 hours.", "engagement_id": "eng-42", "lead_user_id": "user-42", "status": "active", "authorized_from": "2026-10-20T08:00:00Z", "authorized_to": "2026-10-27T08:00:00Z", "timezone": "Asia/Ho_Chi_Minh", "boundary": "authorized_to", "lead_time_seconds": 86400, "engagement_name": "October assessment", "actor": "system"}
}
